{"$schema":"https://json-schema.org/draft/2020-12/schema","type":"object","additionalProperties":false,"required":["schema","run_id","section_id","expected_head","acceptance_test"],"properties":{"schema":{"const":"s0-transaction-evidence/v1"},"run_id":{"type":"string","minLength":1},"section_id":{"const":"S0"},"expected_head":{"type":"object","additionalProperties":false,"required":["revision","transaction_digest"],"properties":{"revision":{"type":"integer","minimum":0},"transaction_digest":{"type":"string","pattern":"^sha256:[0-9a-f]{64}$"}}},"acceptance_test":{"type":"object","additionalProperties":false,"required":["command","exit_status","tests_run","status"],"properties":{"command":{"const":"PYTHONDONTWRITEBYTECODE=1 PYTHONPATH=agent-workflows/src python3 -m unittest discover -s agent-workflows/tests -p 'test_*.py'"},"exit_status":{"const":0},"tests_run":{"type":"integer","minimum":1},"status":{"const":"passed"}}}}}
