{"acceptance_test":{"command":"PYTHONDONTWRITEBYTECODE=1 PYTHONPATH=agent-workflows/src python3 -m unittest discover -s agent-workflows/tests -p 'test_*.py'","exit_status":0,"status":"passed","tests_run":209},"expected_head":{"revision":1,"transaction_digest":"sha256:3333333333333333333333333333333333333333333333333333333333333333"},"run_id":"s0-source-transition-2026-09-04","schema":"s0-transaction-evidence/v1","section_id":"S0"}
